patient ID,diagnosis,context ID,started,completed,How difficult is it on average for the patient to travel for clinical care for their condition?,"In your best estimate, what is the farthest the patient traveled for clinical care (one-way) while seeking their Batten disease diagnosis?","In your best estimate, how frequently does the patient receive care from their neurologist over telehealth?","In your best estimate, what is the distance the patient traveled (one-way) to receive enzyme replacement therapy (ERT), either currently or most recently?",How frequently does the patient receive care from their geneticist over telehealth?,"In your best estimate, what is the distance the patient travels (one-way) to see the geneticist who manages their care?",How difficult is it for the patient to get to their neurologist?,Does the patient currently receive care from a psychologist?,Is there anything else you would like us to know related to the patient’s travel for medical care?,"In your best estimate, how much time did it take for the patient to travel (one-way) to receive enzyme replacement therapy (ERT), either currently or most recently?","In your best estimate, how much time does it take for the patient to travel (one-way) to see the geneticist who manages their care?","What was the primary mode of transportation the patient used to travel to receive enzyme replacement therapy (ERT), either currently or most recently?","In your best estimate, what is the longest amount of time the patient traveled for clinical care (one-way) while seeking their Batten disease diagnosis?",Does the patient currently receive care from a neurologist?,What is the primary mode of transportation the patient uses to travel to appointments with the geneticist who manages their care?,"In your best estimate, how frequently have visits for the patient’s care been cancelled due to the difficulty of traveling to the appointment?",How difficult is it for the patient to travel to their geneticist?,Has the patient ever received enzyme-replacement therapy (ERT)?,"In your best estimate, what is the distance the patient travels (one-way) to see the neurologist who manages their care?",Has the patient’s place of residence ever changed for one of the following reasons related to the patient’s condition?,What is the primary mode of transportation the patient uses to travel to appointments with the neurologist who manages their care?,How difficult is or was it for the patient to get to their appointments for enzyme replacement therapy (ERT)?,"If known on behalf of the patient, why is it difficult for the patient to travel for clinical care?","In your best estimate, what is the farthest distance the patient has ever traveled (one-way) for any clinical care for their condition?",Does the patient currently receive care from a geneticist?,"In your best estimate, how much time does it take for the patient to travel (one-way) to see the neurologist who manages their care?"
FShEiM1N6a,batten,5BNJd6M868,2022-01-20,2022-01-20,Difficult,25–50 miles (40.2–80.5 km),Never,,,,Difficult,No,traffic is always unknown so travel time varies and can be so tiresome for the patient and out family,,,,1–2 hours,Yes,,Rarely,,No,25–50 miles (40.2–80.5 km),The patient has never moved for reasons related to their condition,A vehicle owned by the patient or someone in the patient’s household,,"Difficulty managing symptoms while traveling, Length of time spent in transit",250–500 miles (402.3–804.7 km),No,1–2 hours
sFb8JRwi3r,batten,C3s9ynqQWm,2022-01-24,2022-01-24,Easy,250–500 miles (402.3–804.7 km),Sometimes,25–50 miles (40.2–80.5 km),Rarely,Less than 25 miles (40.2 km),Neutral,,"We initially were driving from the bay area to southern california for ERT, we then moved to the east coast (spouse relocated for job) and intentionally lived closer to a hospital providing ERT.",30 minutes to 1 hour,30 minutes to 1 hour,A vehicle owned by the patient or someone in the patient’s household,5–8 hours,Yes,A vehicle owned by the patient or someone in the patient’s household,Rarely,Neutral,"Yes, at a location other than their home (like a healthcare facility)",25–50 miles (40.2–80.5 km),"To be closer to where the patient receives care, To be closer to family members or others who can assist with caregiving responsibilities",A vehicle owned by the patient or someone in the patient’s household,Neutral,,500–750 miles (804.7–1207.0 km),Yes,30 minutes to 1 hour
MA1IEtt1k9,batten,t9tYJlT92d,2022-01-21,2022-01-21,Neutral,Less than 25 miles (40.2 km),Rarely,,,,Easy,No,Multiple specialists and appointments require significant travel and time.,,,,15–30 minutes,Yes,,Sometimes,,No,25–50 miles (40.2–80.5 km),The patient has never moved for reasons related to their condition,A vehicle owned by the patient or someone in the patient’s household,,,25–50 miles (40.2–80.5 km),No,15–30 minutes
e00n9WnA2a,batten,x6OkoSaaIj,2022-01-21,2022-01-21,Neutral,250–500 miles (402.3–804.7 km),Sometimes,,,,Neutral,No,,,,,2–3 hours,Yes,,Never,,No,250–500 miles (402.3–804.7 km),To be closer to family members or others who can assist with caregiving responsibilities,A vehicle owned by the patient or someone in the patient’s household,,,250–500 miles (402.3–804.7 km),No,2–3 hours
ujnCqbjJkH,batten,xly33tMUYa,2022-01-21,2022-01-21,Easy,100-250 miles (160.9–402.3 km),,,Never,100-250 miles (160.9–402.3 km),,No,,,1–2 hours,,2–3 hours,No,A vehicle owned by the patient or someone in the patient’s household,Rarely,Easy,No,,The patient has never moved for reasons related to their condition,,,,100-250 miles (160.9–402.3 km),Yes,